{
  "schema_version": 1,
  "updated": "2026-10-16 08:03 北京时间",
  "note": "编辑精选、每周投放，非自动从监控信源捞取。",
  "items": [
    {
      "id": "prac-20261014-llm-schema",
      "kind": "工具用法",
      "title": "用 llm --schema 把一段材料收成固定字段，再决定要不要做产品",
      "author": "Simon Willison",
      "url": "https://llm.datasette.io/en/stable/schemas.html",
      "time": "2026-10-14 09:50",
      "difficulty": "进阶",
      "prerequisites": [
        "llm 已能跑通一条提示",
        "一段你自己的、可以外发的短文本"
      ],
      "estimated_time": "约 25 分钟",
      "verified": true,
      "takeaway": "接单前先证明这段乱文字能稳定变成你要的字段。命令行过关，再写进脚本或后台。",
      "steps": [
        "先用文档里的短语法热身：llm --schema 'name, age int, one_sentence_bio' 'invent a cool dog'，确认输出是 JSON",
        "换成你的字段，例如 llm --schema 'client, deliverable, deadline, open_questions'，后面接材料或用管道喂入",
        "执行 llm models --schemas，看当前哪些模型支持 schema，不要假设默认模型永远支持",
        "要一次抽出多条再用 --schema-multi。字段没回来就缩短字段列表，而不是把提示词越写越长",
        "连续三次字段都齐全，再考虑收成模板，或写进自己的脚本"
      ],
      "caution": "模型仍可能漏字段或编造。交给客户前对照原文看一遍。不要把未脱敏的合同或证件送进云端模型。时间为编辑估计。步骤对照 2026-10-14 的 schema 文档。"
    },
    {
      "id": "prac-20261014-llm-template",
      "kind": "工具用法",
      "title": "把常用模型和提示存成 llm 模板，接单时一条命令复用",
      "author": "Simon Willison",
      "url": "https://llm.datasette.io/en/stable/templates.html",
      "time": "2026-10-14 09:40",
      "difficulty": "进阶",
      "prerequisites": [
        "llm 已能成功跑一条提示",
        "有一段你已经手动用顺的系统提示"
      ],
      "estimated_time": "约 30 分钟",
      "verified": true,
      "takeaway": "提示词试顺之后存成模板。下次用 llm -t 名字 喂材料，不必从聊天记录里翻。",
      "steps": [
        "把系统提示存起来：llm --system \"你的说明\" --save 模板名",
        "要固定模型就加上 --model。提示里需要插入对方原文时写 $input",
        "用没有敏感内容的练习文本试跑：echo \"一段练习文本\" | llm -t 模板名",
        "要改措辞就执行 llm templates edit 模板名，或用 llm templates path 找到 YAML 后手改",
        "想把模型选项和提示词拆开时，再试 llm -t 模型模板 -t 提示模板。跑不通就改回单个 -t"
      ],
      "caution": "稳定版文档开头写一次只用一个模板，同页后文又写 -t 可以重复、从左到右合并。以你本机实际行为为准，先用练习文本试。不要把客户原文放进会同步出去的模板。时间为编辑估计。对照 2026-10-14 的模板文档。"
    },
    {
      "id": "prac-20261014-codex-agents",
      "kind": "Skill / 工作流",
      "title": "给 Codex 写一份短 AGENTS.md，避免每个仓库重复叮嘱",
      "author": "OpenAI",
      "url": "https://developers.openai.com/codex/guides/agents-md",
      "time": "2026-10-14 09:30",
      "difficulty": "入门",
      "prerequisites": [
        "已安装并能登录 Codex CLI",
        "一个你正在改的 git 仓库"
      ],
      "estimated_time": "约 25 分钟",
      "verified": true,
      "takeaway": "Codex 开工前会读 AGENTS.md。把怎么构建、怎么测试、什么不要做写成短文件，比每次对话重讲一遍更稳。",
      "steps": [
        "在仓库根打开 Codex，用 CLI 入门页里的 /init 草拟 AGENTS.md，然后改成仓库里真实存在的命令",
        "根文件只留：目录怎么分、怎么安装、测试和 lint 命令、怎样算做完",
        "某子目录规则不同时，在该目录放 AGENTS.override.md。离当前目录更近的文件会盖过上层",
        "个人习惯放 ~/.codex/AGENTS.md，不要写进客户仓库",
        "在仓库根再开一次 Codex，让它复述当前加载了哪些说明。对不上就查是不是空文件，或被 override 盖住"
      ],
      "caution": "默认合并上限约 32KiB，写太长会被截断。/init 只在 Codex CLI 入门页里，本卡链接是说明文件怎么叠放。草稿必须改成你仓库里真实的命令。时间为编辑估计。对照 2026-10-14 的官方说明。"
    },
    {
      "id": "prac-20261014-llm-file",
      "kind": "工具用法",
      "title": "用 llm 命令对本地文件跑一次说明，不必先做应用",
      "author": "Simon Willison",
      "url": "https://llm.datasette.io/en/stable/",
      "time": "2026-10-14 09:20",
      "difficulty": "入门",
      "prerequisites": [
        "有 Python，或已安装 uv / pipx",
        "一份自己的文本或代码文件",
        "要用云端模型时自备 API key"
      ],
      "estimated_time": "约 20 分钟",
      "verified": true,
      "takeaway": "一个人要解释一段代码或改一版说明时，先用命令行把文件送进模型，确认提示词有用，再决定要不要做成产品。",
      "steps": [
        "安装：uv tool install llm，或 pipx install llm，或 pip install llm",
        "云端模型需要钥匙时执行 llm keys set openai，按提示粘贴。不要把钥匙写进仓库",
        "对本地文件试一条：cat 你的文件 | llm -s \"用中文说明这段在做什么，并标出不确定处\"",
        "换模型再加 -m。本机 Ollama 需另装 llm-ollama，先拉取模型再 llm -m 模型名",
        "用 llm logs 回看刚才的提示和回答。能复用的说法留到模板，不要从聊天记录里再抄一遍"
      ],
      "caution": "文档里的默认模型名会变，以你本机 llm models 为准。不要把客户原稿或密钥送进第三方 API。日志默认留在本机。时间为编辑估计。步骤对照 2026-10-14 的官方快速开始。"
    },
    {
      "id": "prac-20261014-claude-skill",
      "kind": "Skill / 工作流",
      "title": "把每周重复粘贴的说明收成一条 Claude Skill",
      "author": "Anthropic · Claude Code 文档",
      "url": "https://code.claude.com/docs/en/skills",
      "time": "2026-10-14 09:10",
      "difficulty": "入门",
      "prerequisites": [
        "电脑上已能运行 claude",
        "手头有一段你反复粘贴进对话的步骤或清单"
      ],
      "estimated_time": "约 30 分钟",
      "verified": true,
      "takeaway": "重复粘贴的交付步骤不要堆在一直加载的说明里。收成个人 Skill 后，正文只在用到时加载，也可以用斜杠命令直接调用。",
      "steps": [
        "建目录 ~/.claude/skills/你的技能名/。这是个人技能，各个项目都能用；只给当前仓库用则放 .claude/skills/",
        "在目录里写 SKILL.md。开头用 --- 包住 YAML，至少写 description：做什么、什么时候该用",
        "description 下面用自己的话写步骤。先跑通纯文字，再考虑文档里那种把命令输出嵌进正文的写法",
        "打开一个仓库，运行 claude。用和 description 相符的话试一次，或输入 /技能名",
        "没有被自动选中就改 description，写清触发场景，而不是把正文越写越长"
      ],
      "caution": "步骤对照 2026-10-14 的官方文档，编辑估计用时。不要把客户密钥写进 SKILL.md。description 决定会不会被自动加载。"
    }
  ]
}
